### ISSUE TITLE
BUG：接收到失败的response响应！ 481 Call/Transaction Does Not Exist

### ISSUE THREAD

**Issue by beyonyc** [648540858/wvp-GB28181-pro#866]
部署方式 wvp-pro/ wvp-prp + zlm都是编译部署/
部署环境 centos7.9+docker
端口开放情况 全部开放
是否是公网部署 否
是否使用https 否
方便的话提供下使用的设备品牌或平台 海康威视
代码更新时间 5月25号，最近几个版本都有这个问题2.6.7，2.6.8

后台日志信息
[点播开始] deviceId: 44010200491320000001, channelId: 44010200491321000001,收流端口：30006, 收流模式：UDP, SSRC: 0102000652, SSRC校验：true
2023-05-26 17:40:49.408  INFO --- SIPCommander : 44010200491320000001_44010200491321000001 分配的ZLM为: FQ3TF8yT83wh5Wvz [192.168.0.122:30006]
2023-05-26 17:40:49.423  INFO --- InviteResponseProcessor : [回复ack] 44010200491320000001-> 192.168.0.125:59271 
2023-05-26 17:41:04.408  INFO --- ZLMHttpHookListener : [ZLM HOOK] rtpServer收流超时：FQ3TF8yT83wh5Wvz->44010200491320000001_44010200491321000001(102000652)
2023-05-26 17:41:07.408  INFO --- PlayServiceImpl : [点播超时] 收流超时 deviceId: 44010200491320000001, channelId: 44010200491321000001，端口：30006, SSRC: 0102000652
**2023-05-26 17:41:07.423  WARN --- SIPProcessorObserver : 接收到失败的response响应！status：481,message:Call/Transaction Does Not Exist**
^C2023-05-26 17:43:14.378 ERROR --- SystemInfoTimerTask : [获取系统信息失败] sleep interrupted

抓包结果
   32 85.257986081 192.168.0.125 → 192.168.0.122 SIP/SDP 715 Status: 200 OK | 
   33 85.258016140 192.168.0.122 → 192.168.0.125 TCP 66 5060 → 59271 [ACK] Seq=3186 Ack=3503 Win=501 Len=0 TSval=882289927 TSecr=9208961
   34 85.260414010 192.168.0.122 → 192.168.0.125 SIP 523 Request: ACK sip:44010200491320000001@192.168.0.125:59271 | 
   35 85.311113372 192.168.0.125 → 192.168.0.122 TCP 66 59271 → 5060 [ACK] Seq=3503 Ack=3643 Win=2693 Len=0 TSval=9208967 TSecr=882289929
   36 103.254163414 192.168.0.122 → 192.168.0.125 SIP 523 Request: BYE sip:44010200491321000001@192.168.0.125:59271 | 
   37 103.256670418 192.168.0.125 → 192.168.0.122 TCP 66 59271 → 5060 [ACK] Seq=3503 Ack=4100 Win=2693 Len=0 TSval=9210762 TSecr=882307923
   **38 103.259361243 192.168.0.125 → 192.168.0.122 SIP 451 Status: 481 Call/Transaction Does Not Exist |** 
   39 103.259385030 192.168.0.125 → 192.168.0.122 TCP 70 59271 → 5060 [PSH, ACK] Seq=3888 Ack=4100 Win=2693 Len=4 TSval=9210762 TSecr=882307923
   40 103.259433966 192.168.0.122 → 192.168.0.125 TCP 66 5060 → 59271 [ACK] Seq=4100 Ack=3892 Win=501 Len=0 TSval=882307929 TSecr=9210762
   41 103.260121216 192.168.0.122 → 192.168.0.125 TCP 68 5060 → 59271 [PSH, ACK] Seq=4100 Ack=3892 Win=501 Len=2 TSval=882307929 TSecr=9210762
   42 103.312232892 192.168.0.125 → 192.168.0.122 TCP 66 59271 → 5060 [ACK] Seq=3892 Ack=4102 Win=2693 Len=0 TSval=9210768 TSecr=882307929
   43 119.995450793 192.168.0.125 → 192.168.0.122 SIP 612 Request: MESSAGE sip:44010200492000000001@4401020049 |

**Comment by mengxing2017** [comment]
30000-30500udp端口放通了？

**Comment by criver31** [comment]
我历史回放也出现这个问题了，481是设备发过来的吧，和zlm有关系吗
