### ISSUE TITLE
上级国标级联问题注册不上  可有偿解决

### ISSUE THREAD

**Issue by qiezhuang** [648540858/wvp-GB28181-pro#2048]
**环境信息:**

 - 1. 部署方式 编译wvp-pro/ wvp-prp + zlm都是编译部署/
 - 2. 部署环境 ubuntu
 - 3. 端口开放情况 全部开放
 - 4. 是否是公网部署 是
 - 5. 是否使用https 是
 - 6. 方便的话提供下使用的设备品牌或平台 腾讯云服务
 - 7. 你做过哪些尝试
 - 8. 代码更新时间（旧版本请更新最新版本代码测试）

**内容描述:**
向上级进行国标级联 一直失败
**截图**  

<img width="543" height="90" alt="Image" src="https://github.com/user-attachments/assets/49c227cc-a992-43f8-96df-ce4ae0dbcbec" />

**抓包文件**
  
[新建 文本文档 (4).txt](https://github.com/user-attachments/files/24072429/4.txt)

**日志**
```
16:04:04.404749 eth0  Out IP (tos 0x0, ttl 64, id 5064, offset 0, flags [DF], proto TCP (6), length 524)
    VM-0-27-ubuntu.48553 > 49.7.197.1.8900: Flags [P.], cksum 0x171b (correct), seq 1:473, ack 1, win 502, options [nop,nop,TS val 2319272954 ecr 3509612292], length 472
E.....@.@.......1.....".g2OO...h...........
.=K..0o.REGISTER sip:34020000002000000003@49.7.197.1:8900 SIP/2.0
Call-ID: 60374244d4828764e4b64a6e622d2521@172.27.0.27
CSeq: 413 REGISTER
From: <sip:34020092992000868740@1101070049>;tag=a16a1715b92e45b8855eb6954d5738a1
To: <sip:34020092992000868740@1101070049>
Via: SIP/2.0/TCP 172.27.0.27:15060;branch=z9hG4bK8770638578;rport
Max-Forwards: 70
Contact: <sip:34020092992000868740@172.27.0.27:15060>
Expires: 3600
User-Agent: WVP-Pro v2.7.4.20251028
Content-Length: 0


16:04:04.440152 eth0  In  IP (tos 0x68, ttl 251, id 29081, offset 0, flags [DF], proto TCP (6), length 52)
    49.7.197.1.8900 > VM-0-27-ubuntu.58393: Flags [F.], cksum 0x2dd9 (correct), seq 1, ack 2, win 43, options [nop,nop,TS val 3509612330 ecr 2319272954], length 0
Eh.4q.@...k.1......."....SL....t...+-......
.0o*.=K.
16:04:04.440167 eth0  Out IP (tos 0x0, ttl 64, id 57197, offset 0, flags [DF], proto TCP (6), length 52)
    VM-0-27-ubuntu.58393 > 49.7.197.1.8900: Flags [.], cksum 0x2beb (correct), seq 2, ack 2, win 502, options [nop,nop,TS val 2319272989 ecr 3509612330], length 0
E..4.m@.@.......1....."....t.SL.....+......
.=L..0o*
16:04:04.442850 eth0  In  IP (tos 0x68, ttl 251, id 55321, offset 0, flags [DF], proto TCP (6), length 52)
    49.7.197.1.8900 > VM-0-27-ubuntu.48553: Flags [.], cksum 0x9ff8 (correct), seq 1, ack 473, win 42, options [nop,nop,TS val 3509612331 ecr 2319272954], length 0
Eh.4..@.....1......."......hg2Q'...*.......
.0o+.=K.
16:04:04.443023 eth0  In  IP (tos 0x68, ttl 251, id 55322, offset 0, flags [DF], proto TCP (6), length 576)
    49.7.197.1.8900 > VM-0-27-ubuntu.48553: Flags [P.], cksum 0xb746 (correct), seq 1:525, ack 473, win 42, options [nop,nop,TS val 3509612331 ecr 2319272954], length 524
Eh.@..@.....1......."......hg2Q'...*.F.....
.0o+.=K.SIP/2.0 401 Unauthorized
Call-ID: 60374244d4828764e4b64a6e622d2521@172.27.0.27
CSeq: 413 REGISTER
From: <sip:34020092992000868740@1101070049>;tag=a16a1715b92e45b8855eb6954d5738a1
To: <sip:34020092992000868740@1101070049>;tag=883f.3d75b9bca761777ec0a1d1fb06f2e655
Via: SIP/2.0/TCP 172.27.0.27:15060;received=43.136.177.247;branch=z9hG4bK8770638578;rport=48553
WWW-Authenticate: Digest realm="49.7.197.1", nonce="69392992b1accbe662e653e9b332945acf19a7ee", qop="auth"
Server: Bytedance AIoT Server
Content-Length: 0


16:04:04.443037 eth0  Out IP (tos 0x0, ttl 64, id 5065, offset 0, flags [DF], proto TCP (6), length 52)
    VM-0-27-ubuntu.48553 > 49.7.197.1.8900: Flags [.], cksum 0x9bfb (correct), seq 473, ack 525, win 501, options [nop,nop,TS val 2319272992 ecr 3509612331], length 0
E..4..@.@.......1.....".g2Q'...t...........
.=L .0o+
16:04:04.445733 eth0  Out IP (tos 0x0, ttl 64, id 37137, offset 0, flags [DF], proto TCP (6), length 60)
    VM-0-27-ubuntu.58197 > 49.7.197.1.8900: Flags [S], cksum 0x3381 (correct), seq 963076461, win 64240, options [mss 1460,sackOK,TS val 2319272995 ecr 0,nop,wscale 7], length 0
E..<..@.@..l....1....U".9gam........3..........
.=L#........
16:04:04.483174 eth0  In  IP (tos 0x68, ttl 251, id 0, offset 0, flags [DF], proto TCP (6), length 60)
    49.7.197.1.8900 > VM-0-27-ubuntu.58197: Flags [S.], cksum 0x0989 (correct), seq 1376708789, ack 963076462, win 43440, options [mss 1424,sackOK,TS val 3509612371 ecr 2319272995,nop,wscale 10], length 0
Eh.<..@.....1......."..UR...9gan....    ..........
.0oS.=L#...

16:04:04.483191 eth0  Out IP (tos 0x0, ttl 64, id 37138, offset 0, flags [DF], proto TCP (6), length 52)
    VM-0-27-ubuntu.58197 > 49.7.197.1.8900: Flags [.], cksum 0xdfc9 (correct), seq 1, ack 1, win 502, options [nop,nop,TS val 2319273032 ecr 3509612371], length 0
E..4..@.@..s....1....U".9ganR..............
.=LH.0oS
16:04:04.483344 eth0  Out IP (tos 0x0, ttl 64, id 5066, offset 0, flags [DF], proto TCP (6), length 52)
    VM-0-27-ubuntu.48553 > 49.7.197.1.8900: Flags [F.], cksum 0x9bd1 (correct), seq 473, ack 525, win 501, options [nop,nop,TS val 2319273033 ecr 3509612331], length 0
E..4..@.@.......1.....".g2Q'...t...........
.=LI.0o+
16:04:04.483400 eth0  Out IP (tos 0x0, ttl 64, id 37139, offset 0, flags [DF], proto TCP (6), length 861)
    VM-0-27-ubuntu.58197 > 49.7.197.1.8900: Flags [P.], cksum 0xdc00 (correct), seq 1:810, ack 1, win 502, options [nop,nop,TS val 2319273033 ecr 3509612371], length 809
E..]..@.@..I....1....U".9ganR..............
.=LI.0oSREGISTER sip:34020000002000000003@49.7.197.1:8900 SIP/2.0
Call-ID: 60374244d4828764e4b64a6e622d2521@172.27.0.27
CSeq: 414 REGISTER
From: <sip:34020092992000868740@1101070049>;tag=a16a1715b92e45b8855eb6954d5738a1
To: <sip:34020092992000868740@1101070049>;tag=883f.3d75b9bca761777ec0a1d1fb06f2e655
Via: SIP/2.0/TCP 172.27.0.27:15060;branch=z9hG4bK3786668285;rport
Max-Forwards: 70
Contact: <sip:34020092992000868740@172.27.0.27:15060>
Expires: 3600
User-Agent: WVP-Pro v2.7.4.20251028
Authorization: Digest username="34020092992000868740",realm="49.7.197.1",nonce="69392992b1accbe662e653e9b332945acf19a7ee",uri="sip:34020000002000000003@49.7.197.1:8900",response="939c068d78bb60e64bb81b24d069a512",algorithm=MD5,qop=auth,cnonce="2b84ae3a-3879-4fa3-918c-e90019ae7fd3",nc=00000001
Content-Length: 0


16:04:04.520829 eth0  In  IP (tos 0x68, ttl 251, id 16768, offset 0, flags [DF], proto TCP (6), length 52)
    49.7.197.1.8900 > VM-0-27-ubuntu.58197: Flags [.], cksum 0xde45 (correct), seq 1, ack 810, win 42, options [nop,nop,TS val 3509612409 ecr 2319273033], length 0
Eh.4A.@.....1......."..UR...9gd....*.E.....
.0oy.=LI
16:04:04.520971 eth0  In  IP (tos 0x68, ttl 251, id 16769, offset 0, flags [DF], proto TCP (6), length 465)
    49.7.197.1.8900 > VM-0-27-ubuntu.58197: Flags [P.], cksum 0x7ae9 (correct), seq 1:414, ack 810, win 42, options [nop,nop,TS val 3509612409 ecr 2319273033], length 413
Eh..A.@.....1......."..UR...9gd....*z......
.0oy.=LISIP/2.0 404 Not here
Call-ID: 60374244d4828764e4b64a6e622d2521@172.27.0.27
CSeq: 414 REGISTER
From: <sip:34020092992000868740@1101070049>;tag=a16a1715b92e45b8855eb6954d5738a1
To: <sip:34020092992000868740@1101070049>;tag=883f.3d75b9bca761777ec0a1d1fb06f2e655
Via: SIP/2.0/TCP 172.27.0.27:15060;received=43.136.177.247;branch=z9hG4bK3786668285;rport=58197
Server: Bytedance AIoT Server
Content-Length: 0


16:04:04.520977 eth0  Out IP (tos 0x0, ttl 64, id 37140, offset 0, flags [DF], proto TCP (6), length 52)
    VM-0-27-ubuntu.58197 > 49.7.197.1.8900: Flags [.], cksum 0xdab8 (correct), seq 810, ack 414, win 501, options [nop,nop,TS val 2319273070 ecr 3509612409], length 0
E..4..@.@..q....1....U".9gd.R..S...........
.=Ln.0oy
16:04:04.521565 eth0  In  IP (tos 0x68, ttl 251, id 55323, offset 0, flags [DF], proto TCP (6), length 52)
    49.7.197.1.8900 > VM-0-27-ubuntu.48553: Flags [F.], cksum 0x9d4d (correct), seq 525, ack 474, win 42, options [nop,nop,TS val 3509612409 ecr 2319273033], length 0
Eh.4..@.....1......."......tg2Q(...*.M.....
.0oy.=L
```

**Comment by zhiqiu0125** [comment]
解决了吗

**Comment by heyu17625-glitch** [comment]
这个 401 → Digest REGISTER → 404 的级联链路我可以接，但建议先做一个固定范围诊断，不直接碰生产密码。

**第一阶段：¥199 / 24 小时级联注册诊断**

- 按当前 WVP 字段逐项核对 `serverGBId`、`serverGBDomain`、`deviceGBId`、`username`、`deviceIp`、`transport` 与 NAT 映射；
- 用脱敏的同一次 REGISTER/401/二次 REGISTER/404 片段复现状态机，区分“上级平台路由/国标域契约不匹配”和“本地请求构造/网络配置”两类根因；
- 交付根因矩阵、最小配置差异、复测命令与一轮同范围复测。若确认是可修的本地代码问题，再单独报价修复，不先承诺一定改代码。

开始只需要 6 项脱敏信息：WVP 精确版本或 commit、ZLM 版本、TCP/UDP、上级平台要求的编码/域规则（中间位可打码）、当前级联配置的字段名与打码值、同一次失败前后的状态码序列。**请不要发送密码、Digest response/nonce/cnonce、私钥、验证码、完整公网地址或生产账号。**

如果现在仍未解决，可以回复“还需要”，我按这个安全范围开工。
